{
  "schema_id": "Phase4ECharacterizationReport",
  "phase_4e_schema_version": "1.0.0-fixture",
  "source_phase_4d": {
    "handoff_schema_id": "Phase4DHandoffContract",
    "handoff_schema_version": "1.0.0-phase4d-fixture",
    "output_closure_sha256": "fe043fdb7d2ce97562b8144826a873023c4f12417c2595dbfc058daa6366c641",
    "source_lineage_manifest_id": "LINEAGE-PHASE4D-000001",
    "phase4e_readiness": "READY_WITH_UNRESOLVED_BOUNDARIES"
  },
  "declared_operating_envelope": { "device_model": "FIXTURE_SYNTHETIC", "depth_engine_version": "FIXTURE_TRUTH_v1", "working_distance_range_meters": [0.5,1.5], "ambient_lux_range": [300,1000] },
  "authority_state": "CONTROL_COMPARED",
  "global_scale_status": { "state": "SCALE_ANCHORED", "method": "DISTRIBUTED_CALIBRATION_ARTIFACTS", "scale_error_ppm": 120, "uncertainty": { "expanded_uncertainty_mm": 0.45, "coverage_factor_k": 2 } },
  "determinism": { "software_pipeline_determinism": "VERIFIED", "physical_reproducibility": "UNVERIFIED" },
  "engineering_use_authority": "FIXTURE_ONLY",
  "claim_locks": { "engineering_metrology_claim": "FORBIDDEN", "production_vehicle_mesh_claim": "FORBIDDEN", "manufacturing_geometry_claim": "FORBIDDEN", "complete_digital_twin_claim": "FORBIDDEN", "physical_validation_evidence_id": null },
  "measurements": [
    { "measurement_id": "M_RAIL_SPACING_01", "label": "Frame rail spacing (fixture)", "value_mm": 864.2, "measurement_basis": "COMBINED_SCAN_AND_PHYSICAL_CONTROL",
      "uncertainty": { "expanded_uncertainty_mm": 1.5, "coverage_factor_k": 2, "confidence_level_pct": 95.4 },
      "use_evaluations": [
        { "declared_use": "BATTERY_ENCLOSURE_PACKAGING", "tolerance_budget_mm": 10.0, "decision_rule": "GUARDED_ACCEPTANCE", "guard_band_mm": 1.0, "disposition": "ACCEPTABLE", "reason_codes": ["SCALE_VERIFIED","UNCERTAINTY_WITHIN_BUDGET"] },
        { "declared_use": "BRACKET_HOLE_FABRICATION_RELEASE", "tolerance_budget_mm": 0.5, "decision_rule": "GUARDED_REJECTION", "guard_band_mm": 0.1, "disposition": "UNSUITABLE", "reason_codes": ["UNCERTAINTY_EXCEEDS_TOLERANCE_BUDGET"] }
      ] }
  ],
  "region_dispositions": [
    { "region_id": "REG_REAR_RIGHT_BATTERY_MOUNT", "disposition": "PROVISIONAL", "reason_codes": ["REGION_BOUNDARY_UNRESOLVED","INSUFFICIENT_VIEW_DIVERSITY"], "recapture_contract_id": "RC_REG_REAR_RIGHT_BATTERY_MOUNT_001" }
  ]
}
